Chapter 5: Adaptive Security for Software Systems,https://www.sciencedirect.com/science/article/pii/B9780128028551000058
The financial aspect of managing technical debt: A systematic literature review,https://www.sciencedirect.com/science/article/pii/S0950584915000762
Attention,https://www.sciencedirect.com/science/article/pii/B0123708702000184
The Explanatory Gap: 30 Years after,https://www.sciencedirect.com/science/article/pii/S1877042814023490
12: Visual Inspection,https://www.sciencedirect.com/science/article/pii/B9780750675314500129
"Effects of toxic Alexandrium species on the survival and feeding rates of brine shrimp, Artemia salina",https://www.sciencedirect.com/science/article/pii/S1872203207600043
1: Architecting Scalable Enterprise Web Applications,https://www.sciencedirect.com/science/article/pii/B9780128022580000019
Structured collaborative workflow design,https://www.sciencedirect.com/science/article/pii/S0167739X08002100
Chapter 1: The End of Wisdom? The Future of Libraries in the Digital Age,https://www.sciencedirect.com/science/article/pii/B9780081001424000014
Avoiding premature machinery failures — applying API 682 and case histories,https://www.sciencedirect.com/science/article/pii/S1350478902801350
Soa antipatterns: An approach for their specification and detection,https://www.worldscientific.com/doi/abs/10.1142/S0218843013410049
Soda: A Tool Support for the Detection of SOA Antipatterns,https://link.springer.com/chapter/10.1007/978-3-642-37804-1_51
Interactive Ontology Alignment using Alignment Antipatterns: A First Experiment,https://dl.acm.org/citation.cfm?id=3021991
Antipattern-based model refactoring for software performance improvement,https://dl.acm.org/citation.cfm?id=2304704
AntiPatterns in Software Architecture,https://dl.acm.org/citation.cfm?id=878114
Software reuse antipatterns,https://dl.acm.org/citation.cfm?id=505492
Detection of SOA Patterns,https://link.springer.com/chapter/10.1007/978-3-642-45005-1_9
Specification and Detection of Business Process Antipatterns,https://link.springer.com/chapter/10.1007/978-3-319-17957-5_3
Detection of SOA Antipatterns,https://link.springer.com/chapter/10.1007/978-3-642-37804-1_43
SOA Worlds,https://link.springer.com/chapter/10.1007/978-3-642-16419-4_2
On semantic detection of cloud API (anti)patterns,https://www.sciencedirect.com/science/article/abs/pii/S095058491830226X
Caching for Enterprise Web Application,https://www.sciencedirect.com/science/article/pii/B9780128022580000044
"Architecture and Patterns for IT: Service Management, Resource Planning, and Governance",https://www.sciencedirect.com/book/9780123705938/architecture-and-patterns-for-it-service-management-resource-planning-and-governance
A healthcare system as a service in the context of vital signs: Proposing a framework for realizing a model,https://www.sciencedirect.com/science/article/pii/S0898122112002817
High-impact refactoring based on architecture violations,https://ieeexplore.ieee.org/document/4145033
"Optimization of adaptation plans for a service-oriented architecture with cost, reliability, availability and performance tradeoff",https://www.sciencedirect.com/science/article/pii/S0164121212003226
Service-oriented architecture structure for healthcare systems utilising vital signs,https://ieeexplore.ieee.org/document/6412954
Workflow design using fragment composition,https://link.springer.com/chapter/10.1007%2F978-3-642-16086-8_6
"Investigating the Relationship between Code Smell Agglomerations and Architectural Concerns: Similarities and Dissimilarities from Distributed, Service-Oriented, and Mobile Systems",https://dl.acm.org/citation.cfm?id=3267184
TIPSTER text phase II configuration management plan,https://dl.acm.org/citation.cfm?id=1119068
TIPSTER text phase II architecture concept,https://dl.acm.org/citation.cfm?id=1119065
A Catalogue of Bad Smells for Software Process,https://dl.acm.org/citation.cfm?id=3275264
Unbiased coevolutionary solution concepts,https://dl.acm.org/citation.cfm?id=1527142
Contemporary Architects,https://link.springer.com/chapter/10.1007/978-1-349-04184-8_1
Improving Object-Oriented Micro Architectural Design Through Knowledge Systematization,https://link.springer.com/chapter/10.1007/11568346_47
Reengineering component-based software systems with Archimetrix,https://link.springer.com/article/10.1007/s10270-013-0341-9
The Directory,https://link.springer.com/chapter/10.1007/978-1-349-03650-9_1
Entries,https://link.springer.com/chapter/10.1007/978-1-349-74030-7_1
An Agile Toolkit to Support Agent-Oriented and Service-Oriented Computing Mechanisms,https://link.springer.com/chapter/10.1007/978-3-540-73460-4_21
Software sustainability: Research and practice from a software architecture viewpoint,https://www.sciencedirect.com/science/article/pii/S0164121217303072
Chapter 9: Architectural Debt Management in Value-Oriented Architecting,https://www.sciencedirect.com/science/article/pii/B978012410464800009X
Beyond ATAM: Early architecture evaluation method for large-scale distributed systems,https://www.sciencedirect.com/science/article/pii/S0164121212003032
A reference architecture for organizing the internal structure of metadata-based frameworks,https://www.sciencedirect.com/science/article/pii/S0164121212003366
Recovering architectural assumptions,https://www.sciencedirect.com/science/article/pii/S0164121205001615
"Quality dimensions of public water services in Abuja, Nigeria",https://www.sciencedirect.com/science/article/pii/S0957178715301399
Application of knowledge-based approaches in software architecture: A systematic mapping study,https://www.sciencedirect.com/science/article/pii/S0950584912002315
Identifying thresholds for object-oriented software metrics,https://www.sciencedirect.com/science/article/pii/S0164121211001385
The design and management of ambience—Implications for hotel architecture and service,https://www.sciencedirect.com/science/article/pii/S0261517707000179
Combating architectural degeneration: a survey,https://www.sciencedirect.com/science/article/pii/S0950584904001740
Chapter 3: Heuristics for a Pervasive Information Architecture,https://www.sciencedirect.com/science/article/pii/B9780123820945000204
Modularity and architecture of PLC-based software for automated production Systems: An analysis in industrial companies,https://www.sciencedirect.com/science/article/pii/S0164121217300985
Aspect based Sentiment Oriented Summarization of Hotel Reviews,https://www.sciencedirect.com/science/article/pii/S1877050917319439
Reusable architectural decision models for enterprise application development,https://link.springer.com/chapter/10.1007/978-3-540-77619-2_2
SOA Design Patterns -- Can They Improve the Process of Model Driven Development?,https://ieeexplore.ieee.org/document/6649769
Anti-Patterns: Integrating Distributed and Heterogeneous Data Sources in SOAs,https://ieeexplore.ieee.org/document/4578306/
TIPSTER text phase II architecture requirements,https://dl.acm.org/citation.cfm?id=1119067
Porting game engines to Direct3D 10: Microsoft's Flight Simulator X,https://dl.acm.org/citation.cfm?id=1281580
SHoP architects,https://dl.acm.org/citation.cfm?id=1400403
An approach to detect Android antipatterns,https://dl.acm.org/citation.cfm?id=2819161
Service-oriented architecture (SOA) concepts and implementations,https://dl.acm.org/citation.cfm?id=2402683
On the Automated Modularisation of Java Programs Using Service Locators,https://link.springer.com/chapter/10.1007/978-3-642-30564-1_9
Detection of REST Patterns and Antipatterns: A Heuristics-Based Approach,https://link.springer.com/chapter/10.1007/978-3-662-45391-9_16
Improving the quality of use case models using antipatterns,https://link.springer.com/article/10.1007/s10270-009-0112-9
Towards Quality-Driven SOA Systems Refactoring Through Planning,https://link.springer.com/chapter/10.1007/978-3-319-17957-5_18
Performance-driven software model refactoring,https://www.sciencedirect.com/science/article/abs/pii/S0950584917301787
"Chapter 5: Architecture Decisions: Who, How, and When?",https://www.sciencedirect.com/science/article/pii/B9780124077720000046
Exploring the impact of inter-smell relations on software maintainability: An empirical study,https://ieeexplore.ieee.org/document/6606614
Clinical experience of ketogenic diet on children with refractory epilepsy.,https://www.ncbi.nlm.nih.gov/pubmed/10910595
"Bad breath--etiological, diagnostic and therapeutic problems",https://www.ncbi.nlm.nih.gov/pubmed/10838713
Halitosis: a review.,https://www.ncbi.nlm.nih.gov/pubmed/15861957
The Sensorial Map of the City,https://dl.acm.org/citation.cfm?id=2890469
WePatch: a system enabling users to improve bad user interfaces on the web,https://dl.acm.org/citation.cfm?id=3156155
CyberSafety 2016: The First International Workshop on Computational Methods in CyberSafety,https://dl.acm.org/citation.cfm?id=2988541
Introduction to Linked Data and Its Lifecycle on the Web,https://link.springer.com/chapter/10.1007/978-3-642-23032-5_1
Twentieth-Century Crime and Mystery Writers,https://link.springer.com/chapter/10.1007/978-1-349-81366-7_1
Abstracts from the 36th Annual Meeting of the Society of General Internal Medicine,https://link.springer.com/article/10.1007/s11606-013-2436-y
Posters,https://link.springer.com/article/10.1007/s12603-009-0095-9
"Society of general internal medicine 29th Annual meeting Los Angeles, California April 26–29, 2006",https://link.springer.com/article/10.1111/j.1525-1497.2006.00469.x
An Incremental Approach for Building Accessible and Usable Web Applications,https://link.springer.com/chapter/10.1007/978-3-642-17616-6_49
Society of General Internal Medicine,https://link.springer.com/article/10.1007/s11606-011-1730-9
Abstracts from the 31st Annual Meeting of the Society of General Internal Medicine,https://link.springer.com/article/10.1007/s11606-008-0556-6
Refactoring code-first Web Services for early avoiding WSDL anti-patterns: Approach and comprehensive assessment,https://www.sciencedirect.com/science/article/pii/S0167642314001646
Exploring Airbnb service quality attributes and their asymmetric effects on customer satisfaction,https://www.sciencedirect.com/science/article/pii/S027843191730909X
Chapter 18: The Trade-Off Between the Three Columns of Sustainability: A Case Study From the Home Service Industry,https://www.sciencedirect.com/science/article/pii/B9780128142424000181
Software trustworthiness 2.0—A semantic web enabled global source code analysis approach,https://www.sciencedirect.com/science/article/pii/S0164121213002173
"The good, the bad, and the unresolved death in Kaliai",https://www.sciencedirect.com/science/article/pii/S0277953603005793
Constructing professional services: For-profit care and domestic work agencies in the Czech Republic,https://www.sciencedirect.com/science/article/pii/S0277539518300815
"Chapter 1: Service, Systems, and Science",https://www.sciencedirect.com/science/article/pii/B9781843346494000019
11: The Supervisor’s Role in Improving Customer Service and Tenant Relations,https://www.sciencedirect.com/science/article/pii/B9780128001134000110
The Top Ten Excuses for Bad Service (and How to Avoid Needing Them),https://www.sciencedirect.com/science/article/pii/S0090261605000173
Integrating ecosystem services and disservices: insights from plant invasions,https://www.sciencedirect.com/science/article/pii/S2212041616302133
Service-orientierte Architekturen mit Web Services: Konzepte-Standards-Praxis,https://books.google.de/books?hl=de&lr=&id=gCspBAAAQBAJ&oi=fnd&pg=PR7&dq=antipattern+web+services&ots=vyNuhSke8H&sig=D5z0Rhy6zhS94YsW4Yf-Mn3bOJM#v=onepage&q=antipattern%20web%20services&f=false
Bottom-up and top-down cobol system migration to web services,https://ieeexplore.ieee.org/abstract/document/6109214/
Anti-pattern free code-first web services for state-of-the-art Java WSDL generation tools,http://ri.conicet.gov.ar/handle/11336/1152
Service-orientierte Architektur,https://link.springer.com/chapter/10.1007/978-3-8274-2550-8_2
An approach for web service discoverability anti-pattern detection for journal of web engineering,https://www.riverpublishers.com/journal/journal_articles/RP_Journal_1540-9589_1215.pdf
Asynchronous Semantics and Anti-patterns for Interacting Web Services,https://ieeexplore.ieee.org/document/4032271/
Spinning Webs into the 21st century,https://dl.acm.org/citation.cfm?id=253752
"On data skewness, stragglers, and MapReduce progress indicators",https://dl.acm.org/citation.cfm?id=2806843
Evaluating the impact of fine-scale burstiness on cloud elasticity,https://dl.acm.org/citation.cfm?id=2806846
Enabling open software project management data with antipatterns,https://dl.acm.org/citation.cfm?id=2818286
What We Do Wrong: Web Antipatterns Explained,https://link.springer.com/chapter/10.1007/978-1-4302-0252-3_1
The Challenges of Web Application Development,https://link.springer.com/chapter/10.1007/978-1-4302-1122-8_2
Bi-level Identification of Web Service Defects,https://link.springer.com/chapter/10.1007/978-3-319-46295-0_22
Computer and Information Security Handbook,https://www.sciencedirect.com/book/9780128038437/computer-and-information-security-handbook
A practical approach to modelling and validating integrity constraints in the Semantic Web,https://www.sciencedirect.com/science/article/abs/pii/S0950705118301862
Identifying architectural bad smells,https://ieeexplore.ieee.org/document/4812762
Toward a catalogue of architectural bad smells,https://link.springer.com/chapter/10.1007/978-3-642-02351-4_10
Medicinal applications of cyclodextrins.,https://www.ncbi.nlm.nih.gov/pubmed/8007740
Automatic detection of bad smells in code: An experimental assessment.,https://www.semanticscholar.org/paper/Automatic-detection-of-bad-smells-in-code%3A-An-Fontana-Braione/5b9f1e1c092a9683a767f86a1169a08e8e3e6a09
"Product metrics for automatic identification of"" bad smell"" design problems in java source-code",https://ieeexplore.ieee.org/document/1509287
Critical incidents: Service failures that matter most,https://journals.sagepub.com/doi/10.1177/001088049803900313
Removing Energy Code Smells with Reengineering Services.,https://dl.gi.de/handle/20.500.12116/17849
A comparison of the service quality of fast food chain franchises,https://www.inderscienceonline.com/doi/abs/10.1504/IJSS.2007.012930
A Validated Set of Smells in Model-View-Controller Architectures,https://ieeexplore.ieee.org/document/7816470/
Dead Code,https://ieeexplore.ieee.org/document/8530095/
Kobold: Web usability as a service,https://ieeexplore.ieee.org/document/8115717/
"If we launch it, will they come? [comms service uptake]",https://ieeexplore.ieee.org/document/4806262/
Refactoring for Usability in Web Applications,https://ieeexplore.ieee.org/document/5518753/
Customizable automatic detection of bad usability smells in mobile accessed web applications,https://dl.acm.org/citation.cfm?id=3098558
Investigating the relationship between bad smells and bugs in software systems,https://dl.acm.org/citation.cfm?id=3132513
Code smells for Model-View-Controller architectures,https://link.springer.com/article/10.1007/s10664-017-9540-2
Detecting Bad Smells of Refinement in Goal-Oriented Requirements Analysis,https://link.springer.com/chapter/10.1007/978-3-319-70625-2_12
From a domain analysis to the specification and detection of code and design smells,https://link.springer.com/article/10.1007/s00165-009-0115-x
Software Design Smell Detection: a systematic mapping study,https://link.springer.com/article/10.1007/s11219-018-9424-8
A metamodeling approach for the identification of organizational smells in multi-agent systems: application to ASPECS,https://link.springer.com/article/10.1007/s10462-016-9521-7
An Approach for Semantically-Enriched Recommendation of Refactorings Based on the Incidence of Code Smells,https://link.springer.com/chapter/10.1007/978-3-319-93375-7_15
Investigating the relation between lexical smells and change- and fault-proneness: an empirical study,https://link.springer.com/article/10.1007/s11219-016-9318-6
On the Use of Smelly Examples to Detect Code Smells in JavaScript,https://link.springer.com/chapter/10.1007/978-3-319-55792-2_2
Prioritizing code-smells correction tasks using chemical reaction optimization,https://link.springer.com/article/10.1007/s11219-014-9233-7
Security code smells in Android ICC,https://link.springer.com/article/10.1007/s10664-018-9673-y
Assessing the capability of code smells to explain maintenance problems: an empirical study combining quantitative and qualitative data,https://link.springer.com/article/10.1007/s10664-013-9250-3
"“Smells Like Teen Shakespirit” Or, the Shakespearean Films of Julia Stiles",https://link.springer.com/chapter/10.1057/9780230105249_3
On the diffuseness and the impact on maintainability of code smells: a large scale empirical investigation,https://link.springer.com/article/10.1007/s10664-017-9535-z
An integrated metamodel-based approach to software model refactoring,https://link.springer.com/article/10.1007/s10270-017-0628-3
On the identification of design problems in stinky code: experiences and tool support,https://link.springer.com/article/10.1186/s13173-018-0078-y
An approach to prioritize code smells for refactoring,https://link.springer.com/article/10.1007/s10515-014-0175-x
Comparing and experimenting machine learning techniques for code smell detection,https://link.springer.com/article/10.1007/s10664-015-9378-4
Twentieth-Century Children’s Writers,https://link.springer.com/chapter/10.1007/978-1-349-03648-6_1
A systematic review on the code smell effect,https://www.sciencedirect.com/science/article/pii/S0164121218301444
How developers perceive smells in source code: A replicated study,https://www.sciencedirect.com/science/article/pii/S0950584916304128
Rapid quality assurance with Requirements Smells,https://www.sciencedirect.com/science/article/pii/S0164121216000789
Understanding metric-based detectable smells in Python software: A comparative study,https://www.sciencedirect.com/science/article/pii/S0950584916301690
Reducing redundancy of test cases generation using code smell detection and refactoring,https://www.sciencedirect.com/science/article/pii/S1319157818300296
User interface design smell: Automatic detection and refactoring of Blob listeners,https://www.sciencedirect.com/science/article/pii/S0950584918300892
An empirical study to improve software security through the application of code refactoring,https://www.sciencedirect.com/science/article/pii/S0950584916303664
A systematic literature review: Refactoring for disclosing code smells in object oriented software,https://www.sciencedirect.com/science/article/pii/S2090447917300412
Automatic detection of usability smells in web applications,https://www.sciencedirect.com/science/article/pii/S1071581916301215
Less is more: Minimizing code reorganization using XTREE,https://www.sciencedirect.com/science/article/pii/S0950584916301641
Perfume: A meditation on the countertransferential drama with babies who smell bad,https://www.sciencedirect.com/science/article/pii/S019745560800097X
A genetic algorithm-based approach for automated refactoring of component-based software,https://www.sciencedirect.com/science/article/pii/S0950584917302495
Contemplating museums’ service failure: Extracting the service quality dimensions of museums from negative on-line reviews,https://www.sciencedirect.com/science/article/pii/S0261517718301316
To what extent can maintenance problems be predicted by code smell detection? – An empirical study,https://www.sciencedirect.com/science/article/pii/S0950584913001614
Insight into consumer experience on UK train transportation services,https://www.sciencedirect.com/science/article/pii/S2214367X18300553
Chapter 4: Encapsulation Smells,https://www.sciencedirect.com/science/article/pii/B9780128013977000047
My baby doesn't smell as bad as yours: The plasticity of disgust,https://www.sciencedirect.com/science/article/pii/S1090513806000195
Code smells as system-level indicators of maintainability: An empirical study,https://www.sciencedirect.com/science/article/pii/S0164121213001258
A Case Study of the Effects of Posttraumatic Stress Disorder on Operational Fire Service Personnel Within the Lancashire Fire and Rescue Service,https://www.sciencedirect.com/science/article/pii/S2093791117302809
"The Good, the Bad and the Ugly: Food Quality in UGC",https://www.sciencedirect.com/science/article/pii/S1877042815012471
5: Sleight of hand: Service or the appearance of service,https://www.sciencedirect.com/science/article/pii/B9780081000762000056
"Conservation in the face of ambivalent public perceptions – The case of peatlands as ‘the good, the bad and the ugly’",https://www.sciencedirect.com/science/article/pii/S0006320716310904
The effects of online reviews on service expectations: Do cultural value orientations matter?,https://www.sciencedirect.com/science/article/pii/S0148296318302261
Chapter 17: Neurotoxic exposure and impairment of the chemical senses of taste and smell,https://www.sciencedirect.com/science/article/pii/B9780444626271000160
"Generating reusable, searchable and executable “architecture constraints as services”",https://www.sciencedirect.com/science/article/pii/S0164121217300213
SOA patterns,http://www.rgoarchitects.com/Files/SOAPatterns/TheKnot.pdf
J2EE antipatterns,https://books.google.de/books?hl=de&lr=&id=8cV8awbqyi0C&oi=fnd&pg=PR5&dq=antipattern+services&ots=HILO4bbQB8&sig=pMB-qIh5y0DY5l8Pyd3xCtrPyZ8#v=onepage&q=antipattern%20services&f=false
Specification and Detection of SOA Antipatterns in Web Services,https://link.springer.com/chapter/10.1007/978-3-319-09970-5_6
Moderne Enterprise Architekturen,https://link.springer.com/book/10.1007/b138869
Legacysoftware,https://link.springer.com/book/10.1007/3-540-30320-0
Investigating the Change-Proneness of Service Patterns and Antipatterns,https://ieeexplore.ieee.org/document/6978164
Search-Based Web Service Antipatterns Detection,https://ieeexplore.ieee.org/document/7332971
Improving SOA antipatterns detection in Service Based Systems by mining execution traces,https://ieeexplore.ieee.org/document/6671307
On the Value of Quality of Service Attributes for Detecting Bad Design Practices,https://ieeexplore.ieee.org/document/8029780
Specification and Detection of SOA Antipatterns,https://ieeexplore.ieee.org/document/6976169/
Detection of Process Antipatterns: A BPEL Perspective,https://ieeexplore.ieee.org/document/6690549
Popular SOA Antipatterns,https://ieeexplore.ieee.org/document/5359597
UniDoSA: The Unified Specification and Detection of Service Antipatterns,https://ieeexplore.ieee.org/document/8325321
Identification of Web Service Refactoring Opportunities as a Multi-objective Problem,https://ieeexplore.ieee.org/document/7558051/
Analyzing the change-proneness of service-oriented systems from an industrial perspective,https://ieeexplore.ieee.org/document/6606718
The Most Important Service-Oriented Antipatterns,https://ieeexplore.ieee.org/document/4299912/
Software performance antipatterns,https://dl.acm.org/citation.cfm?id=350420
Introducing Software Performance Antipatterns in Cloud Computing Environments: Does it Help or Hurt?,https://dl.acm.org/citation.cfm?id=2695528
Performance Antipattern Detection through fUML Model Library,https://dl.acm.org/citation.cfm?id=2693565
A framework for detecting performance design and deployment antipatterns in component based enterprise systems,https://dl.acm.org/citation.cfm?id=1101147
Detecting Antipatterns Using a Web-Based Collaborative Antipattern Ontology Knowledge Base,https://link.springer.com/chapter/10.1007/978-3-642-22056-2_50
An approach for modeling and detecting software performance antipatterns based on first-order logics,https://link.springer.com/article/10.1007/s10270-012-0246-z
Software Performance Antipatterns: Modeling and Analysis,https://link.springer.com/chapter/10.1007/978-3-642-30982-3_9
Using model transformation to refactor use case models based on antipatterns,https://link.springer.com/article/10.1007/s10796-014-9528-z
Applying Design Patterns to Remove Software Performance Antipatterns: A Preliminary Approach,https://www.sciencedirect.com/science/article/pii/S1877050917309948
A model-driven approach to catch performance antipatterns in ADL specifications,https://www.sciencedirect.com/science/article/pii/S0950584916303743
Guilt-based handling of software performance antipatterns in palladio architectural models,https://www.sciencedirect.com/science/article/pii/S0164121214001010
A survey on software smells,https://www.sciencedirect.com/science/article/pii/S0164121217303114
Transient stress-induced cardiomyopathy with an “inverted takotsubo” contractile pattern,https://www.mayoclinicproceedings.org/article/S0025-6196(11)61258-5/fulltext
"Effects of SOA and flash pattern manipulations on ERPs, performance, and preference: implications for a BCI system",https://www.sciencedirect.com/science/article/pii/S016787600500111X
EPK nach BPEL Transformation als Voraussetzung für praktische Umsetzung einer SOA.,https://sebstein.hpfsc.de/publications/stein2007se.pdf
"Reactions with 5-substituted-1, 3-thiazolidine-2, 4-dithiones heterodiene syntheses",https://www.degruyter.com/view/j/znb.1975.30.issue-5-6/znb-1975-5-626/znb-1975-5-626.xml
Pattern based SOA deployment,http://citeseerx.ist.psu.edu/viewdoc/download?doi=10.1.1.841.7718&rep=rep1&type=pdf
Model-driven and pattern-based integration of process-driven SOA models,http://eprints.cs.univie.ac.at/2814/1/06291.ZdunUwe.Paper.820.pdf
The Sender Released Pattern: An SOA Design Pattern for Inter-service Message Exchange,https://ieeexplore.ieee.org/document/6269769/
Simulation on high-speed all-optical pattern recognition using SOA-MZIs,https://ieeexplore.ieee.org/document/6276647/
Feature model for modeling compound SOA design patterns,https://ieeexplore.ieee.org/document/7073224/
