What can context do for web services?,http://www.academia.edu/download/30593709/cacm-vol49n12-dec2006_contextwebservices_maamar-benslimane-narendra.pdf
The web service modeling ontology,https://www.w3.org/Submission/WSMO/
Patterns: service-oriented architecture and web services,https://www.researchgate.net/profile/Ali_Arsanjani/publication/200167132_IBM_Patterns_service-oriented_architecture_and_web_services/links/5488c92e0cf289302e30b950/IBM-Patterns-service-oriented-architecture-and-web-services.pdf
Towards Automatic Discovering for a Real-World RESTful Web Service,https://ieeexplore.ieee.org/document/6385180/
A Clustering-Based Approach for Assisting Semantic Web Service Retrieval,https://ieeexplore.ieee.org/document/4670281/
Frequent Pattern Mining Using Semantic FP-Growth for Effective Web Service Ranking,https://ieeexplore.ieee.org/document/6928977/
An actor-based language to unifying web service orchestration and web service choreography,https://ieeexplore.ieee.org/document/6309038/
Dynamic Web Service Composition with QoS Clustering,https://ieeexplore.ieee.org/document/6928959/
Constructing Operation-Level Ontologies for Web Services,https://ieeexplore.ieee.org/document/6009408/
Ajax and Web Services Integrated Framework Based on Duplicate Proxy Pattern,https://ieeexplore.ieee.org/document/4409291/
Integrating Information-Providing Web Services into the Data Integration System,https://ieeexplore.ieee.org/document/4670265/
Implementation of Communities of Web Service Registries,https://ieeexplore.ieee.org/document/6009454/
Dynamic Web Service Composition Based on Service Integration and HTN Planning,https://ieeexplore.ieee.org/document/6603689/
Efficient Clustering Techniques for Web Services Clustering,https://ieeexplore.ieee.org/document/8524480/
AADSS: Agent-Based Adaptive Dynamic Semantic Web Service Selection,https://ieeexplore.ieee.org/document/4700386/
An Empirical Analysis on Web Service Anti-pattern Detection Using a Machine Learning Framework,https://ieeexplore.ieee.org/document/8377634/
Web Service Discovery via Semantic Association Ranking and Hyperclique Pattern Discovery,https://ieeexplore.ieee.org/document/4061447/
Applying Pattern Oriented Software Engineering to Web Service Development,https://ieeexplore.ieee.org/document/4746477/
Segregating unique service object from multi-web sources for effective visualization,https://ieeexplore.ieee.org/document/6208283/
Model driven distribution pattern design for dynamic web service compositions,https://dl.acm.org/ft_gateway.cfm?id=1145612&ftid=360934&dwn=1&#URLTOKEN#
OpenMVC: a non-proprietry component-based framework for web applications,https://dl.acm.org/ft_gateway.cfm?id=1013527&ftid=278330&dwn=1&#URLTOKEN#
Misuse pattern: spoofing web services,https://dl.acm.org/ft_gateway.cfm?id=2524643&ftid=1529002&dwn=1&#URLTOKEN#
A Service Configuration and Composition Design Pattern for autonomic computing systems using Service Oriented Architecture,https://dl.acm.org/ft_gateway.cfm?id=2393284&ftid=1308188&dwn=1&#URLTOKEN#
Execution patterns for visualizing web services,https://dl.acm.org/ft_gateway.cfm?id=1148499&ftid=368437&dwn=1&#URLTOKEN#
WSAgent: an agent based on web services to promote interoperability between heterogeneous systems in the health domain,https://dl.acm.org/ft_gateway.cfm?id=1028756&ftid=283893&dwn=1&#URLTOKEN#
Formal semantics and expressiveness of a web service composition language,https://dl.acm.org/ft_gateway.cfm?id=2480676&ftid=1368253&dwn=1&#URLTOKEN#
Analyzing patterns in composing teaching materials from the web,https://dl.acm.org/ft_gateway.cfm?id=1958925&ftid=941674&dwn=1&#URLTOKEN#
Overview of some patterns for architecting and managing composite web services,https://dl.acm.org/ft_gateway.cfm?id=844346&type=pdf&#URLTOKEN#
On the structure and authorization management of RESTful web services,https://dl.acm.org/ft_gateway.cfm?id=3167315&ftid=1983722&dwn=1&#URLTOKEN#
"Modeling Workflows, Interaction Patterns, Web Services and Business Processes: The ASM-Based Approach",https://link.springer.com/chapter/10.1007/978-3-540-87603-8_3
Semantic Web-based Intelligent Geospatial Web Services,https://link.springer.com/book/10.1007/978-1-4614-6809-7
Optimal Selection of Web Services for Efficient QoS Driven Web Service Compositions,https://link.springer.com/chapter/10.1007/978-3-642-29280-4_7
An Architectural Pattern to Extend the Interaction Model between Web-Services: The Location-Based Service Context,https://link.springer.com/chapter/10.1007/978-3-540-24593-3_19
Pattern-Based Specification and Validation of Web Services Interaction Properties,https://link.springer.com/content/pdf/10.1007%2F11596141_7.pdf
A Pattern-Based Approach to Business Process Modeling and Implementation in Web Services,https://link.springer.com/chapter/10.1007/978-3-540-75492-3_15
Applying Web Services and Design Patterns to Modeling and Simulating Real-World Systems,https://link.springer.com/content/pdf/10.1007%2F978-3-540-30583-5_38.pdf
POESIA: An ontological workflow approach for composing Web services in agriculture,https://link.springer.com/content/pdf/10.1007%2Fs00778-003-0103-3.pdf
"The Semantic Automated Discovery and Integration (SADI) Web service Design-Pattern, API and Reference Implementation",https://link.springer.com/content/pdf/10.1186%2F2041-1480-2-8.pdf
Semantic Pattern Mining Based Web Service Recommendation,https://link.springer.com/content/pdf/10.1007%2F978-3-319-46295-0_26.pdf
Bootstrapping trust of Web services based on trust patterns and Hidden Markov Models,https://link.springer.com/content/pdf/10.1007%2Fs10115-012-0554-1.pdf
Asynchronous Web Services Communication Patterns in Business Protocols,https://link.springer.com/content/pdf/10.1007%2F11581062_33.pdf
Overview of Transactional Patterns: Combining Workflow Flexibility and Transactional Reliability for Composite Web Services,https://link.springer.com/content/pdf/10.1007%2F11538394_37.pdf
Webservices oriented data mining in knowledge architecture,https://www.sciencedirect.com/science/article/pii/S0167739X08001556/pdfft?md5=ab35a0d4441d35ed61c50b98174c3416&pid=1-s2.0-S0167739X08001556-main.pdf
A geodata warehouse: Using denormalisation techniques as a tool for delivering spatially enabled integrated geological information to geologists,https://www.sciencedirect.com/science/article/pii/S0098300416301960/pdfft?md5=8608818d26b08e0c15d3d6434b0dc70e&pid=1-s2.0-S0098300416301960-main.pdf
Multilingual processing of speech via web services,https://www.sciencedirect.com/science/article/pii/S0885230816302418/pdfft?md5=e79c26609a425a23fdd87b678e62e430&pid=1-s2.0-S0885230816302418-main.pdf
Telemedicine using mobile telecommunication: Towards syntactic interoperability in teleexpertise,https://www.sciencedirect.com/science/article/pii/S0736585314000148/pdfft?md5=f0226f1bad9b7d76351f1ae1032090d0&pid=1-s2.0-S0736585314000148-main.pdf
The use of evolutionary patterns in protein annotation,https://www.sciencedirect.com/science/article/pii/S0959440X12000759/pdfft?md5=2126e17cc478c6c62bcbd993706a301a&pid=1-s2.0-S0959440X12000759-main.pdf
Discovering Coordination Patterns,https://www.sciencedirect.com/science/article/pii/S1571066109005209/pdfft?md5=9d2f9e9546790b985efddf511b51b80c&pid=1-s2.0-S1571066109005209-main.pdf
A novel adaptive re-configuration compliance design pattern for autonomic computing systems,https://www.sciencedirect.com/science/article/pii/S1877705812009824/pdfft?md5=f0d0d44ae31af26a686a2dba746b0dec&pid=1-s2.0-S1877705812009824-main.pdf
Tracking human routines towards adaptive monitoring: the MOVIDA.domus platform,https://www.sciencedirect.com/science/article/pii/S1877050918316387/pdfft?md5=72f4808324eb32e6cfa6dfc69a252b51&pid=1-s2.0-S1877050918316387-main.pdf
Computer-assisted tree taxonomy by automated image recognition,https://www.sciencedirect.com/science/article/pii/S0952197608000870/pdfft?md5=a2c37b496dcfb4cfc98a49b9fcfa79af&pid=1-s2.0-S0952197608000870-main.pdf
A web-based intelligent fault diagnosis system for customer service support,https://www.sciencedirect.com/science/article/pii/S0952197601000185/pdfft?md5=05a203c076b01172b4b2fc015979a0fb&pid=1-s2.0-S0952197601000185-main.pdf
A high precise E-nose for daily indoor air quality monitoring in living environment,https://www.sciencedirect.com/science/article/pii/S0167926016301985/pdfft?md5=65bb348f8321c967d407332103fee602&pid=1-s2.0-S0167926016301985-main.pdf
Enabling visual community learning analytics with Internet of Things devices,https://www.sciencedirect.com/science/article/pii/S0747563218303583
Establishing Core Concepts for Information-Powered Collaborations,https://www.sciencedirect.com/science/article/pii/S0167739X17327619
A pathway for every product? Tools to discover and design plant metabolism,https://www.sciencedirect.com/science/article/pii/S0168945217312505
The Bio-Analytic Resource: Data visualization and analytic tools for multiple levels of plant biology,https://www.sciencedirect.com/science/article/pii/S2214662816300500/pdfft?md5=242638f9bc48bc9d15e721a66c42e2d0&pid=1-s2.0-S2214662816300500-main.pdf
Improving Web Service descriptions for effective service discovery,https://www.sciencedirect.com/science/article/pii/S0167642310000134/pdfft?md5=02b661b2de69c4934c7044648a964fec&pid=1-s2.0-S0167642310000134-main.pdf
A perspective on architectural re-engineering,https://www.sciencedirect.com/science/article/pii/S0167642314000938/pdfft?md5=d427803cd4c6c662212afaecb29a5245&pid=1-s2.0-S0167642314000938-main.pdf
Time will tell: The role of mobile learning analytics in self-regulated learning,https://www.sciencedirect.com/science/article/pii/S0360131515300245/pdfft?md5=e934775b51e21138bf32b5fc9e372444&pid=1-s2.0-S0360131515300245-main.pdf
WFCatalog: A catalogue for seismological waveform data,https://www.sciencedirect.com/science/article/pii/S0098300416308263/pdfft?md5=561cd21ed1c542463ee2819d1a57dd50&pid=1-s2.0-S0098300416308263-main.pdf
Slicing for architectural analysis,https://www.sciencedirect.com/science/article/pii/S0167642310000298/pdfft?md5=f4b51b62136138076433645424693a3b&pid=1-s2.0-S0167642310000298-main.pdf
Creating a spatial multi-criteria decision support system for energy related integrated environmental impact assessment,https://www.sciencedirect.com/science/article/pii/S0195925514000900/pdfft?md5=2c66abfacdff1576e35e349edf3f37ed&pid=1-s2.0-S0195925514000900-main.pdf
Raising interoperability among base registries: The evolution of the Linked Base Registry for addresses in Flanders,https://www.sciencedirect.com/science/article/pii/S1570826818300519
Service-oriented modeling and architecture,https://www.researchgate.net/profile/Ali_Arsanjani/publication/235720456_Service-Oriented_Modeling_and_Architecture/links/5488c92d0cf268d28f08ff39/Service-Oriented-Modeling-and-Architecture.pdf
The enterprise service bus: making service-oriented architecture real,http://svn.wso2.org/repos/wso2/scratch/papers/mediation/ieee/papers/making-sao-real.pdf
Enterprise SOA: service-oriented architecture best practices,https://books.google.de/books?hl=de&lr=&id=R7oGhITYUuUC&oi=fnd&pg=PR17&dq=pattern+service+oriented+architecture&ots=UD6AecGXEH&sig=m0JKg_zimBN1oCUeQHcCeKVsOz4
Using architectural patterns and blueprints for service-oriented architecture,https://ieeexplore.ieee.org/iel5/52/33727/01605179.pdf
Software architecture,https://www.computer.org/csdl/mags/so/2006/02/s2004.html
Using service-oriented architecture and component-based development to build web service applications,http://dit.isuct.ru/Publish_RUP/soa.rup_soma/guidances/whitepapers/resources/using_soa_and_cbd_to_build_ws_applications.pdf
"Impact of service-oriented architecture on enterprise systems, organizational structures, and individuals",http://www.academia.edu/download/6079308/10.1.1.136.6930.pdf
Wsmx-a semantic service-oriented architecture,http://citeseerx.ist.psu.edu/viewdoc/download?doi=10.1.1.61.9549&rep=rep1&type=pdf
Domain based analysis of messaging patterns in service-oriented architecture,https://ieeexplore.ieee.org/document/6513108/
Early performance considerations in a Service-Oriented Architecture: A trade-off analysis,https://ieeexplore.ieee.org/document/6093388/
Formal Approach for the Development of Business Processes in Terms of Service-Oriented Architectures Using Pi-ADL,https://ieeexplore.ieee.org/document/4730479/
Fifteen Years of Service-Oriented Architecture at Credit Suisse,https://ieeexplore.ieee.org/document/6654116/
Development of manufacturing execution system service oriented software architecture,https://ieeexplore.ieee.org/document/6693646/
Attribute-Based Architecture Patterns for Lightweight Service-Oriented Architectures,https://ieeexplore.ieee.org/document/5358559/
Connectivity abstractions and “service-oriented network” architecture,https://ieeexplore.ieee.org/document/6167439/
Architecture-oriented design method for smart tourism innovative service systems,https://ieeexplore.ieee.org/document/7840284/
A Unified Design Method of Asynchronous Service-Oriented Architecture Based on the Models and Patterns of Asynchronous Message Exchanges,https://ieeexplore.ieee.org/document/4670218/
Research on the framework of Process Equipment Service-Oriented Platform,https://ieeexplore.ieee.org/document/5974960/
An xADL Extension for Service Oriented Architecture Design,https://ieeexplore.ieee.org/document/6579474/
Qualitative Analysis of the Impact of SOA Patterns on Quality Attributes,https://ieeexplore.ieee.org/document/6319243/
A Practical and Automated Approach for Engineering Service-Oriented Applications with Design Patterns,https://ieeexplore.ieee.org/document/6903211/
Monitoring performance-related QoS properties in service-oriented systems: a pattern-based architectural decision model,https://dl.acm.org/ft_gateway.cfm?id=2396729&ftid=1311560&dwn=1&#URLTOKEN#
Pattern based adaptation for service oriented applications,https://dl.acm.org/ft_gateway.cfm?id=2088894&ftid=1135105&dwn=1&#URLTOKEN#
Aspect-oriented modeling approach to define routing in enterprise service bus architectures,https://dl.acm.org/ft_gateway.cfm?id=1370735&ftid=498567&dwn=1&#URLTOKEN#
Qos architectural patterns for self-architecting software systems,https://dl.acm.org/ft_gateway.cfm?id=1809084&ftid=807828&dwn=1&#URLTOKEN#
Capability-based service identification in service-oriented legacy modernization,https://dl.acm.org/ft_gateway.cfm?id=2739021&ftid=1614523&dwn=1&#URLTOKEN#
Dynamically reconfiguring services in SOA applications: a pattern-based approach,https://dl.acm.org/ft_gateway.cfm?id=2603082&ftid=1492078&dwn=1&#URLTOKEN#
Patterns for service composition,https://dl.acm.org/ft_gateway.cfm?id=1992913&ftid=981081&dwn=1&#URLTOKEN#
An approach for pattern mining through grounded theory techniques and its applications to process-driven SOA patterns,https://dl.acm.org/ft_gateway.cfm?id=2739020&ftid=1614534&dwn=1&#URLTOKEN#
Feature Model as a Design-pattern-based Service Contract for the Service Provider in the Service Oriented Architecture,https://link.springer.com/content/pdf/10.1007%2F978-3-319-93375-7_12.pdf
A Pattern Language for Process Execution and Integration Design in Service-Oriented Architectures,https://link.springer.com/chapter/10.1007/978-3-642-10832-7_6
Service-Oriented Architecture,https://link.springer.com/referenceworkentry/10.1007/978-0-387-73003-5_1037
Event Driven Service-oriented Architecture,https://link.springer.com/content/pdf/10.1007%2F978-0-387-39940-9_2577.pdf
Modeling e-Negotiation Processes for a Service Oriented Architecture,https://link.springer.com/content/pdf/10.1007%2Fs10726-006-9038-6.pdf
"XML Based Integration of Web, Mobile and Desktop Components in a Service Oriented Architecture",https://link.springer.com/chapter/10.1007/978-3-540-85863-8_67
Trust-based service composition and selection in service oriented architecture,https://link.springer.com/content/pdf/10.1007%2Fs12083-017-0593-1.pdf
Service-oriented architecture for ontologies supporting multi-agent system negotiations in virtual enterprise,https://link.springer.com/content/pdf/10.1007%2Fs10845-010-0469-1.pdf
Language Support for Service Interactions in Service-Oriented Architecture,https://link.springer.com/chapter/10.1007/978-3-642-14819-4_6
Towards a self-adaptive service-oriented methodology based on extended SOMA,https://link.springer.com/content/pdf/10.1631%2FFITEE.1400040.pdf
An MDA-Based Modeling and Design of Service Oriented Architecture,https://link.springer.com/content/pdf/10.1007%2F11758532_76.pdf
From inter-organizational business process models to service-oriented architecture models,https://link.springer.com/content/pdf/10.1007%2Fs11761-018-0246-0.pdf
A service-oriented architecture for integrating the modeling and formal verification of genetic regulatory networks,https://link.springer.com/content/pdf/10.1186%2F1471-2105-10-450.pdf
Service oriented architecture for medical image processing,https://link.springer.com/content/pdf/10.1007%2Fs11548-008-0231-8.pdf
Pattern-Based Context Establishment for Service-Oriented Architectures,https://link.springer.com/chapter/10.1007/978-3-642-30835-2_7
Anomaly Detection System Based on Service Oriented Architecture,https://link.springer.com/chapter/10.1007/978-3-642-28493-9_40
Research on Service-Oriented Geospatial Information Sharing Mechanism and Technical Architecture,https://link.springer.com/chapter/10.1007/978-3-642-25986-9_67
Usage-Aware Service Identification for Architecture Migration of Object-Oriented Systems to SoA,https://link.springer.com/content/pdf/10.1007%2F978-3-319-64471-4_6.pdf
Design patterns for BIM-based service-oriented architectures,https://www.sciencedirect.com/science/article/pii/S0926580512000696/pdfft?md5=13ab7f32394b5e1f4d8627e75deefc9b&pid=1-s2.0-S0926580512000696-main.pdf
An Approach to Knowledge Management in Construction Service – Oriented Architecture,https://www.sciencedirect.com/science/article/pii/S1877050916319718/pdfft?md5=34cdf1e412893c84d61376bfd3b93949&pid=1-s2.0-S1877050916319718-main.pdf
Service vulnerability scanning based on service-oriented architecture in Web service environments,https://www.sciencedirect.com/science/article/pii/S1383762113000143/pdfft?md5=fa8c7f1929166c754f21cd5c2304d3bf&pid=1-s2.0-S1383762113000143-main.pdf
COLLECT: COLLaborativE ConText-aware service oriented architecture for intelligent decision-making in the Internet of Things,https://www.sciencedirect.com/science/article/pii/S0957417417303573/pdfft?md5=c567d95f55075fd8715598b8e09cf5ac&pid=1-s2.0-S0957417417303573-main.pdf
Specification and automatic checking of architecture constraints on object oriented programs,https://www.sciencedirect.com/science/article/pii/S095058491830079X
A component based unified architecture for utility service in cloud,https://www.sciencedirect.com/science/article/pii/S0167739X17302935
Application of service oriented architecture to finite element analysis,https://www.sciencedirect.com/science/article/pii/S0965997812000968/pdfft?md5=fceeb0d29072172b1521e82d6b5f24c2&pid=1-s2.0-S0965997812000968-main.pdf
Manufacturing Service: From e-Work and Service-Oriented Approach towards a Product-Service Architecture,https://www.sciencedirect.com/science/article/pii/S2405896315005583/pdfft?md5=a34a4219bb1e7820002378fbc138ad62&pid=1-s2.0-S2405896315005583-main.pdf
Methodology for the model-driven development of service oriented IoT applications,https://www.sciencedirect.com/science/article/pii/S1383762118301875
A Service-Oriented Architecture for Networked Highway,https://www.sciencedirect.com/science/article/pii/S1877705811018923/pdfft?md5=d007920d43627a84d8cfb37ef4a9459a&pid=1-s2.0-S1877705811018923-main.pdf
An Approach for QoS Based Fault Reconfiguration in Service Oriented Architecture,https://www.sciencedirect.com/science/article/pii/S1877050915002094/pdfft?md5=ebb6b69f1eeefd453b0ce5d8307b6fca&pid=1-s2.0-S1877050915002094-main.pdf
RSAM: An enhanced architecture for achieving web services reliability in mobile cloud computing,https://www.sciencedirect.com/science/article/pii/S1319157817300642/pdfft?md5=719259d3cda7147ba0719eff88b9b8bc&pid=1-s2.0-S1319157817300642-main.pdf
New frontiers of reverse engineering,https://ieeexplore.ieee.org/document/4221630
Are RESTful APIs well-designed? Detection of their linguistic (anti) patterns,https://link.springer.com/chapter/10.1007/978-3-662-48616-0_11
Web service antipatterns detection using genetic programming,https://dl.acm.org/citation.cfm?id=2754724
Schedule of bad smell detection and resolution: A new way to save effort,https://ieeexplore.ieee.org/document/5680918
Applications programming in a Health Sciences Computing center,https://dl.acm.org/citation.cfm?id=810528
Free lunches in pareto coevolution,https://dl.acm.org/citation.cfm?id=1570132
Co-optimization algorithms,https://dl.acm.org/citation.cfm?id=1389166
A no-free-lunch framework for coevolution,https://dl.acm.org/citation.cfm?id=1389163
Abstracts of Documents in This Supplement,https://link.springer.com/chapter/10.1007/978-1-4615-5971-9_1
Demise of the Dogmatic Universe,https://link.springer.com/referenceworkentry/10.1007/978-3-540-68832-7_8
On the Interplay Between Software Testing and Evolution and its Effect on Program Comprehension,https://link.springer.com/chapter/10.1007/978-3-540-76440-3_8
High-performance computing framework with desynchronized information propagation for large-scale simulations,https://www.sciencedirect.com/science/article/pii/S1877750318303776
Improving the Service Operations of Fast-food Restaurants,https://www.sciencedirect.com/science/article/pii/S1877042816305237
Evolutionary computing applied to customer relationship management: A survey,https://www.sciencedirect.com/science/article/pii/S0952197616301439
A survey on mobile affective computing,https://www.sciencedirect.com/science/article/pii/S1574013717300382
Identification and application of Extract Class refactorings in object-oriented systems,https://www.sciencedirect.com/science/article/pii/S0164121212001057
"Big Data for supply chain management in the service and manufacturing sectors: Challenges, opportunities, and future perspectives",https://www.sciencedirect.com/science/article/pii/S0360835216302388
"Chapter Four: Anti-Pattern Detection: Methods, Challenges, and Open Issues",https://www.sciencedirect.com/science/article/pii/B9780128001608000048
A systematic review on search-based refactoring,https://www.sciencedirect.com/science/article/pii/S0950584916303779
Automatically detecting opportunities for web service descriptions improvement,https://link.springer.com/chapter/10.1007/978-3-642-16283-1_18
An exploratory study of the impact of antipatterns on class change- and fault-proneness,https://link.springer.com/article/10.1007/s10664-011-9171-y
Software Product Line Architectures: Reviewing the Literature and Identifying Bad Smells,https://www.semanticscholar.org/paper/Software-Product-Line-Architectures-%3A-Reviewing-the-Crnkovic/0536538d286c435742e4776ce37c459e29f424e7
Software-evolvability,https://gi.de/informatiklexikon/software-evolvability/
Genetics of taste and smell: poisons and pleasures,https://www.ncbi.nlm.nih.gov/pubmed/21036327
Towards a computer assisted approach for migrating legacy systems to SOA,https://link.springer.com/chapter/10.1007/978-3-642-31128-4_36
An empirical evaluation of the quality of interoperability specifications for the web,https://www.researchgate.net/publication/221593537_An_Empirical_Evaluation_of_the_Quality_of_Interoperability_Specifications_for_the_Web
Biomonitoring study of people living near or working at a municipal solid-waste incinerator before and after two years of operation,https://www.ncbi.nlm.nih.gov/pubmed/11005431
Arsenic,https://link.springer.com/chapter/10.1007/978-3-662-01611-4_1
The Dictionary,https://link.springer.com/chapter/10.1007/978-1-349-12428-2_1
Software Evolution and Modernisation,https://link.springer.com/chapter/10.1007/978-3-8348-8675-0_3
Semantic and translation priming from a first language to a second and back: Making sense of the findings,https://link.springer.com/article/10.3758/MC.37.5.569
DUSM: A Method for Requirements Specification and Refinement Based on Disciplined Use Cases and Screen Mockups,https://link.springer.com/article/10.1007/s11390-018-1866-8
The Examples of Applications of the Agent Systems,https://link.springer.com/chapter/10.1007/978-3-319-13197-9_5
Mechanisms underlying auditory and cross-modal emotional attentional biases: Engagement with and disengagement from aversive auditory stimuli,https://link.springer.com/article/10.1007/s11031-018-9739-6
"“Adore”, a logical meta-model supporting business process evolution",https://www.sciencedirect.com/science/article/pii/S0167642312001220
Chapter 3.2: Air Pollution and Air Quality,https://www.sciencedirect.com/science/article/pii/B9780128092705000078
Semantic Memory: Some Insights from Feature-Based Connectionist Attractor Networks,https://www.sciencedirect.com/science/article/pii/S0079742103450020
Software test-code engineering: A systematic mapping,https://www.sciencedirect.com/science/article/pii/S0950584914001487
Olfactory ERPs in an odor/visual congruency task differentiate ApoE ?4 carriers from non-carriers,https://www.sciencedirect.com/science/article/pii/S0006899311022311
Neurobehavioral performance in human volunteers during inhalation exposure to the unpleasant local irritant cyclohexylamine,https://www.sciencedirect.com/science/article/pii/S0161813X12001465
Diverse tastes: Genetics of sweet and bitter perception,https://www.sciencedirect.com/science/article/pii/S0031938406002459
Contribution of Social Science Electives to Engineering Students,https://www.sciencedirect.com/science/article/pii/S187704281305413X
"Social attitudes towards smoking in pregnancy in East Surrey: A qualitative study of smokers, former smokers and non-smokers",https://www.sciencedirect.com/science/article/pii/S1355184107000038
